{
  "schema_version": "1.0.0",
  "request_id": "cgr-edit-request",
  "project_id": "project-cgr-edit-request",
  "run_id": "run-cgr-edit-request-001",
  "compiler_input_ref": {
    "artifact_id": "ci-edit-request",
    "artifact_version": "1.0.0",
    "artifact_uri": "artifact://compiler-input/ci-edit-request/1.0.0",
    "checksum": "sha256:ci-edit-request"
  },
  "final_frame_spec_ref": {
    "artifact_id": "ffs-product-edit",
    "artifact_version": "1.0.0",
    "artifact_uri": "artifact://final-frame/ffs-product-edit/1.0.0",
    "checksum": "sha256:ffs-product-edit"
  },
  "target_generator": {
    "provider": "TEST_PROVIDER",
    "model_family": "HYPOTHETICAL_IMAGE_MODEL",
    "model_name": "hypothetical-v1",
    "profile_id": "profile-hypothetical-v1",
    "profile_version": "1.0.0"
  },
  "generation_mode": "EDIT",
  "compiled_instruction": {
    "instruction_format": "PLAIN_TEXT",
    "final_visual_description": "Final edited image is the supplied edit target with only the declared product-label region replaced; all other pixels, layout, lighting, subject relationships and global structure remain preserved.",
    "plain_text": "Edit the supplied image directly. Replace only the declared product-label region and preserve the complete global structure."
  },
  "control_layer": {
    "creative_authority": "NONE",
    "preserve_identity": true,
    "preserve_reference_authority": true,
    "preserve_text_locks": true,
    "preserve_edit_target": true,
    "preserve_composition": true,
    "semantic_change_forbidden": true
  },
  "asset_bindings": [
    {
      "asset_id": "asset-edit-target",
      "adapter_slot": "edit_target",
      "authority": "EDIT_TARGET_AUTHORITY",
      "required": true,
      "source_ref": "compiler_input.assets.asset-edit-target"
    }
  ],
  "reference_instructions": [],
  "identity_instructions": [],
  "text_instructions": [],
  "negative_constraints": [
    {
      "constraint_id": "neg-random-objects",
      "statement": "Do not add unapproved narrative objects.",
      "source_ref": "final_frame_spec.generation_requirements.forbidden_visual_elements"
    },
    {
      "constraint_id": "neg-composition",
      "statement": "Do not alter focal hierarchy or occupy protected negative space.",
      "source_ref": "final_frame_spec.protected_fields.composition"
    }
  ],
  "output_parameters": {
    "aspect_ratio": "16:9",
    "output_role": "FINAL_IMAGE",
    "number_of_variants": 1
  },
  "protected_fields": [
    {
      "field_id": "pf-composition",
      "target": "composition",
      "rule": "Preserve hierarchy and subject region.",
      "source_ref": "final_frame_spec.protected_fields.composition",
      "loss_category": "COMPOSITION_LOSS"
    },
    {
      "field_id": "pf-depth",
      "target": "depth_system",
      "rule": "Preserve layered depth architecture.",
      "source_ref": "final_frame_spec.protected_fields.depth",
      "loss_category": "DEPTH_LOSS"
    },
    {
      "field_id": "pf-edit-target",
      "target": "edit_target.global_structure",
      "rule": "Direct edit only; reconstruction is forbidden.",
      "source_ref": "compiler_input.mode_context",
      "loss_category": "COMPOSITION_LOSS"
    }
  ],
  "variation_policy": [
    {
      "domain": "identity",
      "level": "NONE",
      "rule": "No identity variation.",
      "source_ref": "compiler_input.controlled_variation.identity"
    },
    {
      "domain": "composition",
      "level": "NONE",
      "rule": "No composition variation.",
      "source_ref": "compiler_input.controlled_variation.composition"
    },
    {
      "domain": "microdetails",
      "level": "MEDIUM",
      "rule": "Incidental texture may vary.",
      "source_ref": "compiler_input.controlled_variation.microdetails"
    }
  ],
  "capability_report": {
    "profile_data_classification": "HYPOTHETICAL_TEST_DATA",
    "supported_requirements": [
      {
        "requirement_ref": "final_frame_spec.depth_system",
        "capability_ref": "profile.supports_structured_prompt",
        "status": "SUPPORTED",
        "impact": "No loss expected.",
        "recommended_action": "PROCEED"
      }
    ],
    "partially_supported_requirements": [],
    "unsupported_requirements": [],
    "unknown_capabilities": []
  },
  "compatibility_status": "FULLY_COMPATIBLE",
  "warnings": [],
  "errors": [],
  "compiler_trace": {
    "compiler_profile": "test-compiler-profile",
    "compiler_version": "1.0.0",
    "input_artifact": "ci-edit-request",
    "transformations_applied": [
      {
        "transformation": "Converted semantic regions and visual systems into target-generator phrasing.",
        "source_ref": "final_frame_spec",
        "semantic_change": false
      }
    ],
    "warnings": [],
    "capability_decisions": [
      "All hard requirements mapped to supported hypothetical capabilities."
    ],
    "output_format_used": "PLAIN_TEXT"
  },
  "provenance": {
    "producer": "GENERATOR_COMPILER",
    "producer_version": "1.0.0",
    "created_at": "2026-08-09T21:15:00-03:00",
    "sources": [
      "FINAL_FRAME_SPEC",
      "COMPILER_PROFILE",
      "GENERATOR_CAPABILITY_REGISTRY",
      "SYSTEM_DERIVED"
    ]
  },
  "status": "REQUEST_READY",
  "mode_context": {
    "edit_target_asset_id": "asset-edit-target",
    "locked_regions": [
      {
        "region_id": "locked-global",
        "x": 0,
        "y": 0,
        "width": 1,
        "height": 1
      }
    ],
    "editable_regions": [
      {
        "region_id": "editable-label",
        "x": 0.62,
        "y": 0.48,
        "width": 0.18,
        "height": 0.2
      }
    ],
    "edit_delta": "Replace only the product label artwork.",
    "preserve_global_structure": true,
    "reconstruction_forbidden": true
  }
}
