{
  "schema_version": "1.0.0",
  "request_id": "cgr-structured-instruction-request",
  "project_id": "project-cgr-structured-instruction-request",
  "run_id": "run-cgr-structured-instruction-request-001",
  "compiler_input_ref": {
    "artifact_id": "ci-structured-instruction-request",
    "artifact_version": "1.0.0",
    "artifact_uri": "artifact://compiler-input/ci-structured-instruction-request/1.0.0",
    "checksum": "sha256:ci-structured-instruction-request"
  },
  "final_frame_spec_ref": {
    "artifact_id": "ffs-aviation-mentor",
    "artifact_version": "1.0.0",
    "artifact_uri": "artifact://final-frame/ffs-aviation-mentor/1.0.0",
    "checksum": "sha256:ffs-aviation-mentor"
  },
  "target_generator": {
    "provider": "TEST_PROVIDER",
    "model_family": "HYPOTHETICAL_IMAGE_MODEL",
    "model_name": "hypothetical-v1",
    "profile_id": "profile-hypothetical-v1",
    "profile_version": "1.0.0"
  },
  "generation_mode": "GENERATE",
  "compiled_instruction": {
    "instruction_format": "STRUCTURED",
    "final_visual_description": "Final frame contains a dominant right-side subject integrated across foreground, subject and atmospheric background planes, with the left-side functional space and approved lighting hierarchy preserved.",
    "structured_blocks": [
      {
        "block_id": "composition",
        "role": "FINAL_STATE",
        "content": "Dominant subject remains on the right; functional negative space remains clear on the left.",
        "source_refs": [
          "final_frame_spec.composition"
        ]
      },
      {
        "block_id": "depth",
        "role": "FINAL_STATE",
        "content": "Foreground, subject plane and atmospheric background remain visibly separated and integrated.",
        "source_refs": [
          "final_frame_spec.depth_system"
        ]
      }
    ]
  },
  "control_layer": {
    "creative_authority": "NONE",
    "preserve_identity": true,
    "preserve_reference_authority": true,
    "preserve_text_locks": true,
    "preserve_edit_target": false,
    "preserve_composition": true,
    "semantic_change_forbidden": true
  },
  "asset_bindings": [],
  "reference_instructions": [],
  "identity_instructions": [],
  "text_instructions": [],
  "negative_constraints": [
    {
      "constraint_id": "neg-random-objects",
      "statement": "Do not add unapproved narrative objects.",
      "source_ref": "final_frame_spec.generation_requirements.forbidden_visual_elements"
    },
    {
      "constraint_id": "neg-composition",
      "statement": "Do not alter focal hierarchy or occupy protected negative space.",
      "source_ref": "final_frame_spec.protected_fields.composition"
    }
  ],
  "output_parameters": {
    "aspect_ratio": "16:9",
    "output_role": "BACKGROUND_FOR_HTML_OVERLAY",
    "number_of_variants": 1
  },
  "protected_fields": [
    {
      "field_id": "pf-composition",
      "target": "composition",
      "rule": "Preserve hierarchy and subject region.",
      "source_ref": "final_frame_spec.protected_fields.composition",
      "loss_category": "COMPOSITION_LOSS"
    },
    {
      "field_id": "pf-depth",
      "target": "depth_system",
      "rule": "Preserve layered depth architecture.",
      "source_ref": "final_frame_spec.protected_fields.depth",
      "loss_category": "DEPTH_LOSS"
    },
    {
      "field_id": "pf-lighting",
      "target": "lighting_system",
      "rule": "Preserve navy/cyan halo and edge separation without contaminating the left copy field.",
      "source_ref": "final_frame_spec.protected_fields.lighting",
      "loss_category": "LIGHTING_INTENT_LOSS"
    }
  ],
  "variation_policy": [
    {
      "domain": "identity",
      "level": "NONE",
      "rule": "No identity variation.",
      "source_ref": "compiler_input.controlled_variation.identity"
    },
    {
      "domain": "composition",
      "level": "NONE",
      "rule": "No composition variation.",
      "source_ref": "compiler_input.controlled_variation.composition"
    },
    {
      "domain": "microdetails",
      "level": "MEDIUM",
      "rule": "Incidental texture may vary.",
      "source_ref": "compiler_input.controlled_variation.microdetails"
    }
  ],
  "capability_report": {
    "profile_data_classification": "HYPOTHETICAL_TEST_DATA",
    "supported_requirements": [
      {
        "requirement_ref": "final_frame_spec.depth_system",
        "capability_ref": "profile.supports_structured_prompt",
        "status": "SUPPORTED",
        "impact": "No loss expected.",
        "recommended_action": "PROCEED"
      }
    ],
    "partially_supported_requirements": [],
    "unsupported_requirements": [],
    "unknown_capabilities": []
  },
  "compatibility_status": "FULLY_COMPATIBLE",
  "warnings": [],
  "errors": [],
  "compiler_trace": {
    "compiler_profile": "test-compiler-profile",
    "compiler_version": "1.0.0",
    "input_artifact": "ci-structured-instruction-request",
    "transformations_applied": [
      {
        "transformation": "Converted semantic regions and visual systems into target-generator phrasing.",
        "source_ref": "final_frame_spec",
        "semantic_change": false
      }
    ],
    "warnings": [],
    "capability_decisions": [
      "All hard requirements mapped to supported hypothetical capabilities."
    ],
    "output_format_used": "STRUCTURED"
  },
  "provenance": {
    "producer": "GENERATOR_COMPILER",
    "producer_version": "1.0.0",
    "created_at": "2026-08-09T21:15:00-03:00",
    "sources": [
      "FINAL_FRAME_SPEC",
      "COMPILER_PROFILE",
      "GENERATOR_CAPABILITY_REGISTRY",
      "SYSTEM_DERIVED"
    ]
  },
  "status": "REQUEST_READY"
}
